{
  "$schema": "https://raw.githubusercontent.com/bauer-group/LIB-BG-MCPCore/main/src/bg_mcpcore/profile/schema.json",
  "id": "petstore",
  "display_name": "BG Petstore (OpenAPI demo)",
  "instructions": "Tier-1 demo: tools generated from an OpenAPI spec, no Python.",
  "backend": {
    "base_url": "https://petstore.example.com",
    "api_base_path": ""
  },
  "auth": {
    "inbound": {
      "mode": "none"
    },
    "outbound": {
      "type": "bearer_env",
      "value_from_env": "PETSTORE_TOKEN"
    }
  },
  "tools": {
    "source": "openapi",
    "spec": {
      "source": "petstore-mini.json"
    },
    "name_overrides": {
      "GET /pets": "list_pets",
      "POST /pets": "create_pet"
    },
    "annotations": "by_http_method"
  },
  "cache": {
    "ttl": 300,
    "scope": "public"
  }
}
